<!ELEMENT UNIVERSITIES (UNIVERSITY+)>
<!ELEMENT UNIVERSITY (UNIVERSITY_NAME,PASS_POINT,PLAN,CITY)>
<!ELEMENT UNIVERSITY_NAME (#PCDATA)>
<!ELEMENT PASS_POINT (#PCDATA)>
<!ELEMENT PLAN (#PCDATA)>
<!ELEMENT CITY (#PCDATA)>
