<?xmlversion = "1.0" encoding="UTF-8"?>
<?xml-stylesheet type="text/css" href="1.css"?>
<!DOCTYPE UNIVERSITIES SYSTEM "UNIVERSITIES.dtd">
<UNIVERSITIES>
<UNIVERSITY>
<UNIVERSITY_NAME> БГУИР </UNIVERSITY_NAME>
<PASS_POINT> 323</PASS_POINT>
<PLAN> 150 </PLAN>
<CITY> Минск </CITY>
</UNIVERSITY>
<UNIVERSITY>
<UNIVERSITY_NAME> БНТУ </UNIVERSITY_NAME>
<PASS_POINT> 330</PASS_POINT>
<PLAN> 200 </PLAN>
<CITY> Минск </CITY>
</UNIVERSITY>
<UNIVERSITY>
<UNIVERSITY_NAME> БРУ </UNIVERSITY_NAME>
<PASS_POINT> 250</PASS_POINT>
<PLAN> 200 </PLAN>
<CITY> Могилёв </CITY>
</UNIVERSITY>
</UNIVERSITIES>